id,name,introduction,code_list,url,img_url
cnn_katie-hunt,Katie Hunt,"Katie Hunt writes about science and health for CNN Digital based in London.  She was previously a senior digital producer in Hong Kong, where she led coverage of China.","[{'code_type': 'twitter', 'code_content': 'https://twitter.com/KatieHunt20'}]",https://us.cnn.com/profiles/katie-hunt,https://cdn.cnn.com/cnnnext/dam/assets/141217021344-katie-hunt-large-169.jpg
cnn_lilit-marcus,Lilit Marcus,Lilit Marcus is a Travel Producer for CNN Digital Worldwide. ,"[{'code_type': 'twitter', 'code_content': 'https://twitter.com/lilitmarcus'}, {'code_type': 'www.instagram', 'code_content': 'https://www.instagram.com/lilitgoes'}]",https://us.cnn.com/profiles/lilit-marcus,https://cdn.cnn.com/cnnnext/dam/assets/170706145624-lilit-marcus-large-169.jpg
cnn_rick-lewchuk-profile,Rick Lewchuk,Rick Lewchuk is SVP of Creative Marketing and Brand Standards for CNN Worldwide,[],https://us.cnn.com/profiles/rick-lewchuk-profile,https://cdn.cnn.com/cnnnext/dam/assets/210303140322-rick-lewchuk-profile-large-169.jpg
cnn_tim-hume,Tim Hume,"Tim Hume writes and reports out of London, focusing on Europe and the Middle East. Got a story? Email tim.hume@cnn.com or find him on Twitter: ","[{'code_type': 'twitter', 'code_content': 'https://twitter.com/tim_hume'}]",https://us.cnn.com/profiles/tim-hume,https://cdn.cnn.com/cnnnext/dam/assets/141217155250-tim-hume-profile-large-169.jpg
cnn_julia-hollingsworth,Julia Hollingsworth,"Julia Hollingsworth is a Senior Producer for CNN Digital Worldwide, based in Hong Kong. She writes about the Asia-Pacific region with a focus on feature stories.","[{'code_type': 'twitter', 'code_content': 'https://twitter.com/juliaholli'}]",https://us.cnn.com/profiles/julia-hollingsworth,https://cdn.cnn.com/cnnnext/dam/assets/190610134353-julia-hollingsworth-large-169.jpg
cnn_matthew-hilk,Matthew Hilk,Matthew Hilk is the Vice President of News and Managing Editor of CNN/U.S. ,[],https://us.cnn.com/profiles/matthew-hilk,https://cdn.cnn.com/cnnnext/dam/assets/190627135737-matthew-hilk-headshot-large-169.jpg
cnn_katia-hetter,Katia Hetter,Senior Editor Katia Hetter oversees the CNN Digital Science and Wellness team.,"[{'code_type': 'twitter', 'code_content': 'https://twitter.com/katiahetter'}]",https://us.cnn.com/profiles/katia-hetter,https://cdn.cnn.com/cnnnext/dam/assets/141202155108-katia-hetter-profile-large-169.jpg
cnn_sergio-hernandez,Sergio Hernandez,Sergio Hernandez is CNN's data editor.,"[{'code_type': 'twitter', 'code_content': 'https://twitter.com/cerealcommas'}, {'code_type': 'www.linkedin', 'code_content': 'https://www.linkedin.com/in/cerealcommas'}]",https://us.cnn.com/profiles/sergio-hernandez,https://cdn.cnn.com/cnnnext/dam/assets/161023145837-sergio-hernandez-profile-photo-large-169.jpg
cnn_erica-henry,Erica Henry ,"Erica Henry is Vice President of News, where she oversees management of the Newsgathering Southeast regional team.","[{'code_type': 'twitter', 'code_content': 'https://twitter.com/@ericacnn'}]",https://us.cnn.com/profiles/erica-henry,https://cdn.cnn.com/cnnnext/dam/assets/150804140339-erica-henry-large-169.jpg
cnn_andrew-kaczynski,Andrew Kaczynski,"Andrew Kaczynski is the senior editor and founding member of CNN's KFile — the leading investigation team for the social, mobile generation. ","[{'code_type': 'twitter', 'code_content': 'https://twitter.com/KFILE'}]",https://us.cnn.com/profiles/andrew-kaczynski,https://cdn.cnn.com/cnnnext/dam/assets/190128192925-andrew-kaczynski-headshot-large-169.jpg
cnn_blathnaid-healy,Blathnaid Healy,"Blathnaid Healy is Senior Director EMEA, CNN Digital International, based in the London bureau. ","[{'code_type': 'twitter', 'code_content': 'https://twitter.com/blathnaidhealy'}, {'code_type': 'www.linkedin', 'code_content': 'https://www.linkedin.com/in/blathnaid-healy-5a77a01'}]",https://us.cnn.com/profiles/blathnaid-healy,https://cdn.cnn.com/cnnnext/dam/assets/180626132224-blathnaid-healy-profile-large-169.jpg
cnn_eric-hall-profile,Eric  Hall,Eric Hall is the Executive Producer of CNN Newsroom with Brooke Baldwin (2-4pm ET) and CNN Right Now with Brianna Keilar (1-2pm ET). ,[],https://us.cnn.com/profiles/eric-hall-profile,https://cdn.cnn.com/cnnnext/dam/assets/200326102930-eric-hall-headshot-large-169.jpg
cnn_sonya-hamasaki,Sonya Hamasaki,"Sonya Hamasaki is a newsgathering producer based in Los Angeles, helping outlook breaking news coverage across the Western and Central regions of the U.S. ",[],https://us.cnn.com/profiles/sonya-hamasaki,https://cdn.cnn.com/cnnnext/dam/assets/220218165914-sonya-hamasaki-large-169.jpg
cnn_jamie-gumbrecht,Jamie Gumbrecht,Jamie Gumbrecht is a supervising editor for CNN Health,"[{'code_type': 'twitter', 'code_content': 'https://twitter.com/jamieg'}]",https://us.cnn.com/profiles/jamie-gumbrecht,https://cdn.cnn.com/cnnnext/dam/assets/140926164114-jamie-gumbrecht-profile-image-large-169.jpg
cnn_omar-jimenez,Omar Jimenez ,Omar Jimenez is a CNN Correspondent based in Chicago. ,"[{'code_type': 'twitter', 'code_content': 'https://twitter.com/OmarJimenez'}]",https://us.cnn.com/profiles/omar-jimenez,https://cdn.cnn.com/cnnnext/dam/assets/170919104145-omarjimenezhs-large-169.jpg
cnn_brandon-griggs,Brandon Griggs,"Brandon Griggs is a Senior Editor with CNN Digital, overseeing coverage of culture, race, religion and immigration.",[],https://us.cnn.com/profiles/brandon-griggs,https://cdn.cnn.com/cnnnext/dam/assets/140926154319-brandon-griggs-profile-image-large-169.jpg
cnn_jason-kwok,Jason Kwok,"Jason Kwok is an Associate Creative Director for CNN Digital, based in Hong Kong.",[],https://us.cnn.com/profiles/jason-kwok,https://cdn.cnn.com/cnnnext/dam/assets/141229141310-jason-kwok-profile-large-169.jpg
cnn_sandra-gonzalez,Sandra Gonzalez,"Sandra Gonzalez is a senior entertainment editor for CNN, primarily covering television and film news, trends and features out of the Los Angeles bureau.","[{'code_type': 'twitter', 'code_content': 'https://twitter.com/TheSandraG'}]",https://us.cnn.com/profiles/sandra-gonzalez,https://cdn.cnn.com/cnnnext/dam/assets/170619101431-sandra-gonzalez-large-169.jpg
cnn_zahra-jamshed,Zahra Jamshed ,Zahra Jamshed is a Features Producer for CNN based at the network's Asia-Pacific headquarters in Hong Kong.,"[{'code_type': 'facebook', 'code_content': 'https://facebook.com/zahra.jamshed'}, {'code_type': 'twitter', 'code_content': 'https://twitter.com/zahra_jamshed'}, {'code_type': 'www.linkedin', 'code_content': 'https://www.linkedin.com/in/zahra-jamshed-01123b49'}, {'code_type': 'www.instagram', 'code_content': 'https://www.instagram.com/zee_jammin'}]",https://us.cnn.com/profiles/zahra-jamshed,https://cdn.cnn.com/cnnnext/dam/assets/171213122311-zahra-jamshed-large-169.jpg
cnn_steve-george,Steve George ,"Steve George is the Director of CNN Digital Worldwide for the Asia-Pacific region, based in Hong Kong. ","[{'code_type': 'twitter', 'code_content': 'https://twitter.com/steve0george'}]",https://us.cnn.com/profiles/steve-george,https://cdn.cnn.com/cnnnext/dam/assets/170824160156-steve-george-cnn-international-large-169.jpg
cnn_sarita-harilela,Sarita Harilela,"Sarita Harilela is a Director of Coverage for CNN International, based at the network's Asia-Pacific headquarters in Hong Kong. ",[],https://us.cnn.com/profiles/sarita-harilela,https://cdn.cnn.com/cnnnext/dam/assets/200326190352-sarita-harilela-bio-large-169.jpg
cnn_roxanne-garcia-bell,Roxanne Garcia-Bell,Roxanne Garcia-Bell is the senior director of coverage for CNN/U.S. ,[],https://us.cnn.com/profiles/roxanne-garcia-bell,https://cdn.cnn.com/cnnnext/dam/assets/200204160350-roxanne-garcia-bell-large-169.jpg
cnn_lucy-kafanov,Lucy Kafanov,Lucy Kafanov is a CNN correspondent based in the network's Denver bureau.,"[{'code_type': 'twitter', 'code_content': 'https://twitter.com/LucyKafanov'}, {'code_type': 'www.instagram', 'code_content': 'https://www.instagram.com/LucyKafanov'}]",https://us.cnn.com/profiles/lucy-kafanov,https://cdn.cnn.com/cnnnext/dam/assets/150212224154-anchor-background-large-169.jpg
cnn_whit-friese,Whit Friese,Whit Friese is the Vice President and Group Creative Director of Creative Marketing at CNN. He is responsible for creative content encompassing all network brands and shows from domestic to international across all platforms. ,[],https://us.cnn.com/profiles/whit-friese,https://cdn.cnn.com/cnnnext/dam/assets/200305172016-whit-friese-headshot-2-large-169.jpg
cnn_mary-anne-fox-profile,Mary Anne Fox,Mary Anne Fox is the Vice President of Northeast News for CNN.,[],https://us.cnn.com/profiles/mary-anne-fox-profile,https://cdn.cnn.com/cnnnext/dam/assets/170208183056-mary-anne-fox-profile-large-169.jpg
cnn_darryl-forges,Darryl Forges,"Darryl Forges is a national correspondent for CNN Newsource, CNN's network of more than 1,000 affiliates. He is based at CNN's headquarters in Atlanta, Georgia.",[],https://us.cnn.com/profiles/darryl-forges,https://cdn.cnn.com/cnnnext/dam/assets/191205160254-darryl-forbes-large-169.jpg
cnn_allison-flexner-profile,Allison Flexner,Allison Flexner is a Senior Director of Coverage based at the network's global headquarters in Atlanta.,[],https://us.cnn.com/profiles/allison-flexner-profile,https://cdn.cnn.com/cnnnext/dam/assets/200324102333-allison-flexner-headshot-large-169.jpg
cnn_mckenna-ewen,Mack Ewen,"Mack Ewen is a producer for CNN Digital in Minneapolis, MN.","[{'code_type': 'twitter', 'code_content': 'https://twitter.com/McKennaEwen'}]",https://us.cnn.com/profiles/mckenna-ewen,https://cdn.cnn.com/cnnnext/dam/assets/171101115559-mckenna-ewen-large-169.jpg
cnn_tricia-escobedo-profile,Tricia Escobedo ,"Tricia and her team plan and execute the network's digital editorial strategy for upcoming news events and business priorities. She has been a part of the network's breaking news coverage of the September 11 attacks, the Afghanistan and Iraq wars, Hurricane Katrina and the Gulf oil spill. She's also helped lead the digital execution of content around CNN Heroes, CNN Films and Original Series.","[{'code_type': 'facebook', 'code_content': 'https://facebook.com/cnn'}, {'code_type': 'twitter', 'code_content': 'https://twitter.com/triciaCNN'}, {'code_type': 'www.instagram', 'code_content': 'https://www.instagram.com/cnn'}]",https://us.cnn.com/profiles/tricia-escobedo-profile,https://cdn.cnn.com/cnnnext/dam/assets/140919131954-tricia-escobedo-profile-page-headshot-large-169.jpg
cnn_cynthia-hudson-profile,Cynthia Hudson,Cynthia Hudson is senior vice president and managing director of CNN en Español and Hispanic strategy for CNN/U.S. ,[],https://us.cnn.com/profiles/cynthia-hudson-profile,https://cdn.cnn.com/cnnnext/dam/assets/200520120038-cynthia-hudson-headshot-large-169.jpg
cnn_meara-erdozain-profile,Meara Erdozain,Meara Erdozain is Senior Vice President of Programming for CNN International. She oversees all live news programming on CNN International.,[],https://us.cnn.com/profiles/meara-erdozain-profile,https://cdn.cnn.com/cnnnext/dam/assets/210604161226-meara-erdozain-profile-photo-large-169.jpg
cnn_jeremy-dunn,Jeremy Dunn,"Jeremy Dunn serves as the Supervising Producer for CNN 10.  He is responsible for developing digital, mobile, and social content for CNN's next generation of news consumers.",[],https://us.cnn.com/profiles/jeremy-dunn,https://cdn.cnn.com/cnnnext/dam/assets/141211171800-jeremy-dunn-large-169.jpg
cnn_katie-glaeser,Katie Glaeser,"Katie Glaeser is an Editor with CNN's News and Alerting team, with an emphasis on breaking news and mobile programming.","[{'code_type': 'twitter', 'code_content': 'https://twitter.com/ktCNN'}]",https://us.cnn.com/profiles/katie-glaeser,https://cdn.cnn.com/cnnnext/dam/assets/171111210539-katie-glaeser-large-169.jpg
cnn_matt-dornic,Matt Dornic,Matt Dornic oversees strategic communications for CNN Worldwide and its growing portfolio of emerging brands including Great Big Story. He also manages CNN's business relationships with digital platform partners.,"[{'code_type': 'facebook', 'code_content': 'https://facebook.com/mattdornic'}, {'code_type': 'twitter', 'code_content': 'https://twitter.com/mdornic'}, {'code_type': 'www.instagram', 'code_content': 'https://www.instagram.com/mdornic'}]",https://us.cnn.com/profiles/matt-dornic,https://cdn.cnn.com/cnnnext/dam/assets/180607135546-matt-dornic-large-169.jpg
cnn_curt-devine,Curt Devine,"Curt Devine is a producer for CNN Investigates, based in Washington, DC.","[{'code_type': 'twitter', 'code_content': 'https://twitter.com/CurtDevine'}]",https://us.cnn.com/profiles/curt-devine,https://cdn.cnn.com/cnnnext/dam/assets/180731163001-curt-devine-profile-photo-large-169.jpg
cnn_lauren-del-valle,Lauren del Valle,Lauren del Valle is an Associate Producer in CNN's New York Bureau.,"[{'code_type': 'twitter', 'code_content': 'https://twitter.com/Lauren_delvalle'}]",https://us.cnn.com/profiles/lauren-del-valle,https://cdn.cnn.com/cnnnext/dam/assets/180125152407-lauren-delvalle-profile-pic-large-169.jpg
cnn_sarah-dean-profile,Sarah Dean,"Sarah Dean is a senior news editor for CNN International, overseeing EMEA newsgathering assignments.",[],https://us.cnn.com/profiles/sarah-dean-profile,https://cdn.cnn.com/cnnnext/dam/assets/200701122605-sarah-dean-profile-photo-large-169.jpg
cnn_brian-fung,Brian Fung ,"Brian Fung is a technology reporter who covers the intersection of business and policy. A native of Washington, D.C., Brian spent almost six years at The Washington Post, where he wrote extensively about the media industry's struggle to adapt to the Internet; the battle over net neutrality; and the rise of novel innovations such as self-driving cars. ","[{'code_type': 'twitter', 'code_content': 'https://twitter.com/b_fung'}]",https://us.cnn.com/profiles/brian-fung,https://cdn.cnn.com/cnnnext/dam/assets/200323133428-brian-fung-profile-large-169.jpg
cnn_karla-cripps,Karla Cripps,Karla Cripps is a Senior Digital Producer who oversees CNN Travel's Asia-Pacific coverage.,"[{'code_type': 'twitter', 'code_content': 'https://twitter.com/karla_cripps'}, {'code_type': 'www.instagram', 'code_content': 'https://www.instagram.com/karla.cripps'}]",https://us.cnn.com/profiles/karla-cripps,https://cdn.cnn.com/cnnnext/dam/assets/141229130659-karla-cripps-profile-large-169.jpg
cnn_annie-grayer,Annie Grayer,"Annie Grayer is a reporter covering Capitol Hill. Most recently, she was a video producer and covered the 2020 presidential election, including Senator Bernie Sanders' campaign. ","[{'code_type': 'twitter', 'code_content': 'https://twitter.com/AnnieGrayerCNN'}]",https://us.cnn.com/profiles/annie-grayer,https://cdn.cnn.com/cnnnext/dam/assets/181204102045-annie-grayer-large-169.jpg
cnn_kevin-conlon-profile,Kevin Conlon,Massachusetts native Kevin Conlon lists catching a foul ball at Fenway Park among his proudest achievements.  ,[],https://us.cnn.com/profiles/kevin-conlon-profile,https://cdn.cnn.com/cnnnext/dam/assets/150106212215-kevin-conlon-profile-large-169.jpg
cnn_kevin-flower-profile,Kevin Flower,"Kevin Flower is the Vice President  and Western Bureau Chief, based out of the network's Los Angeles bureau.",[],https://us.cnn.com/profiles/kevin-flower-profile,https://cdn.cnn.com/cnnnext/dam/assets/190719170240-kevin-flower-profile-large-169.jpg
cnn_zachary-cohen-profile,Zachary Cohen,"Zachary Cohen is a writer and reporter for CNN Politics, where he focuses on the national security beat in Washington, covering the Pentagon, US State Department, White House, intelligence community and Capitol Hill.  ","[{'code_type': 'twitter', 'code_content': 'https://twitter.com/@ZcohenCNN'}]",https://us.cnn.com/profiles/zachary-cohen-profile,https://cdn.cnn.com/cnnnext/dam/assets/170706100527-zachary-cohen-large-169.jpg
cnn_david-gelles,David Gelles,David P. Gelles is the Executive Producer of CNN+ political and live event programming. ,[],https://us.cnn.com/profiles/david-gelles,https://cdn.cnn.com/cnnnext/dam/assets/180618144957-david-gelles-headshot-large-169.jpg
cnn_laura-coates,Laura Coates,"Laura Coates, CNN Senior Legal Analyst and SiriusXM Host, is a well-respected attorney, commentator, author, and adjunct professor at the George Washington University School of Law. Coates' depth of experience and broad expertise has earned her acclaim across all media platforms.  ","[{'code_type': 'twitter', 'code_content': 'https://twitter.com/thelauracoates'}, {'code_type': 'www.instagram', 'code_content': 'https://www.instagram.com/thelauracoates'}]",https://us.cnn.com/profiles/laura-coates,https://cdn.cnn.com/cnnnext/dam/assets/200616110900-laura-coates-background-large-169.jpg
cnn_stephy-chung,Stephy Chung ,"Stephy Chung is the Asia Editor of CNN Style, based in Hong Kong. She drives the editorial direction of coverage in the APAC region, commissioning in-depth distinctives and managing the daily production of multimedia stories.",[],https://us.cnn.com/profiles/stephy-chung,https://cdn.cnn.com/cnnnext/dam/assets/171213123619-stephy-chung-large-169.jpg
cnn_flora-charner-profile,Flora Charner,"Flora Charner is the Weekend Director of Coverage for CNN International Newsgathering, based in Atlanta, Georgia.","[{'code_type': 'twitter', 'code_content': 'https://twitter.com/FloraCharner'}, {'code_type': 'www.instagram', 'code_content': 'https://www.instagram.com/floracharner'}]",https://us.cnn.com/profiles/flora-charner-profile,https://cdn.cnn.com/cnnnext/dam/assets/170202143741-flora-charner-profile-pic-large-169.jpg
cnn_adam-charlton-profile,Adam Charlton,Adam Charlton is the Executive Producer of CNN Newsroom with Pamela Brown based at the network's global headquarters in Atlanta.,[],https://us.cnn.com/profiles/adam-charlton-profile,https://cdn.cnn.com/cnnnext/dam/assets/200324134730-adam-charlton-headshot-large-169.jpg
cnn_david-chalian,David Chalian,David Chalian is a vice president and CNN's Political Director where he oversees political coverage across all CNN platforms.  ,"[{'code_type': 'twitter', 'code_content': 'https://twitter.com/DavidChalian'}]",https://us.cnn.com/profiles/david-chalian,https://cdn.cnn.com/cnnnext/dam/assets/150422115501-david-chalian-profile-large-169.jpg
cnn_mariano-castillo,Mariano Castillo,Mariano Castillo is an editor on The Row for CNN en Español,"[{'code_type': 'facebook', 'code_content': 'https://facebook.com/marianocastillowrites'}, {'code_type': 'twitter', 'code_content': 'https://twitter.com/marianowrites'}, {'code_type': 'www.linkedin', 'code_content': 'https://www.linkedin.com/in/marianocastillowrites'}, {'code_type': 'www.instagram', 'code_content': 'https://www.instagram.com/marianocnn'}]",https://us.cnn.com/profiles/mariano-castillo,https://cdn.cnn.com/cnnnext/dam/assets/140929104812-mariano-castillo-profile-image-large-169.jpg
cnn_terence-burlij,Terence Burlij,"Terence Burlij is CNN's Deputy Political Director based in Washington, D.C. where he helps coordinate political coverage across all CNN platforms. Burlij provides editorial guidance for the network's daily coverage in addition to writing for CNN Politics. ","[{'code_type': 'twitter', 'code_content': 'https://twitter.com/burlij'}]",https://us.cnn.com/profiles/terence-burlij,https://cdn.cnn.com/cnnnext/dam/assets/150519161104-terence-burlij-profile-large-169.jpg
cnn_scott-bronstein,Scott Bronstein,Scott Bronstein is an Emmy award-winning senior producer and writer for CNN's investigative unit. Bronstein joined the network in October 2004. ,"[{'code_type': 'facebook', 'code_content': 'https://facebook.com/scott.bronstein1'}, {'code_type': 'twitter', 'code_content': 'https://twitter.com/scottbronstein'}]",https://us.cnn.com/profiles/scott-bronstein,https://cdn.cnn.com/cnnnext/dam/assets/170824182229-scott-bronstein-large-169.jpg
cnn_karol-brinkley-profile,Karol Brinkley,"Karol Brinkley has been with CNN since 2011, most recently as a Senior Producer with the video programming team where she produces and programs content for the CNN.com website and mobile apps.",[],https://us.cnn.com/profiles/karol-brinkley-profile,https://cdn.cnn.com/cnnnext/dam/assets/140926170059-karol-brinkley-profile-image-large-169.jpg
cnn_daniella-diaz,Daniella Diaz,"Daniella Diaz is a reporter covering Capitol Hill. She was most recently a video producer covering former Vice President Mike Pence's re-election efforts and before that, Massachusetts Sen. Elizabeth Warren's presidential campaign.","[{'code_type': 'twitter', 'code_content': 'https://twitter.com/DaniellaMicaela'}]",https://us.cnn.com/profiles/daniella-diaz,https://cdn.cnn.com/cnnnext/dam/assets/181129180441-daniella-diaz-large-169.jpg
cnn_lisa-france,Lisa Respers France,"Lisa Respers France is a senior writer for CNN's entertainment team and former host of the ""Lisa's Desk"" franchise. ","[{'code_type': 'facebook', 'code_content': 'https://facebook.com/lisarespers'}, {'code_type': 'twitter', 'code_content': 'https://twitter.com/LisaFranceCNN'}]",https://us.cnn.com/profiles/lisa-france,https://cdn.cnn.com/cnnnext/dam/assets/140929104601-lisa-france-profile-image-large-169.jpg
cnn_eric-bradner,Eric Bradner,"Eric Bradner is a national political reporter for CNN, covering the 2018 midterm elections and the 2020 Democratic presidential contest.","[{'code_type': 'facebook', 'code_content': 'https://facebook.com/EricBradnerCNN'}, {'code_type': 'twitter', 'code_content': 'https://twitter.com/ericbradner'}]",https://us.cnn.com/profiles/eric-bradner,https://cdn.cnn.com/cnnnext/dam/assets/141231144627-eric-bradner-large-169.jpg
cnn_kyle-blaine,Kyle Blaine,"Kyle Blaine is a senior campaign editor for CNN Politics. He is also the editor for CNN's KFile— the leading investigation team for the social, mobile generation.","[{'code_type': 'twitter', 'code_content': 'https://twitter.com/kyletblaine'}]",https://us.cnn.com/profiles/kyle-blaine,https://cdn.cnn.com/cnnnext/dam/assets/170126172009-kyle-blaine-large-169.jpg
cnn_marshall-cohen,Marshall Cohen,"Marshall Cohen is a CNN reporter based in Washington, ",[],https://us.cnn.com/profiles/marshall-cohen,https://cdn.cnn.com/cnnnext/dam/assets/200303132243-marshall-cohen-background-large-169.jpg
cnn_harry-enten,Harry Enten,"Harry Enten is a Senior Data Reporter and the host of CNN's ""Margins of Error"" podcast, where he specializes in data-driven journalism.","[{'code_type': 'twitter', 'code_content': 'https://twitter.com/ForecasterEnten'}]",https://us.cnn.com/profiles/harry-enten,https://cdn.cnn.com/cnnnext/dam/assets/180411145419-harry-enten-profile-large-169.jpg
cnn_nelli-black,Nelli Black,"Nelli Black is a senior producer for CNN's investigations unit, based in New York.","[{'code_type': 'twitter', 'code_content': 'https://twitter.com/nelliblk'}]",https://us.cnn.com/profiles/nelli-black,https://cdn.cnn.com/cnnnext/dam/assets/190416175818-nelli-black-profile-photo-large-169.jpg
cnn_courtney-coupe,Courtney Coupe,"Courtney Coupe is the Senior Vice President of Content Strategy and Operations for CNN+. Coupe oversees strategy, programming, and production of content on CNN+, CNN's direct-to-consumer streaming platform, in addition to running content for CNN Audio.",[],https://us.cnn.com/profiles/courtney-coupe,https://cdn.cnn.com/cnnnext/dam/assets/191018144259-courtney-coupe-large-169.jpg
cnn_kate-bennett,Kate Bennett,"Kate Bennett is a correspondent for CNN, where she covers the White House.","[{'code_type': 'twitter', 'code_content': 'https://twitter.com/KateBennett_DC'}, {'code_type': 'www.instagram', 'code_content': 'https://www.instagram.com/cnncoverline'}]",https://us.cnn.com/profiles/kate-bennett,https://cdn.cnn.com/cnnnext/dam/assets/170224160608-kate-bennett-large-169.jpg
cnn_father-edward-beck-profile,Father Edward Beck ,"Father Edward Beck is a Roman Catholic priest and member of the Passionist Community, and serves as a CNN religion commentator. ","[{'code_type': 'facebook', 'code_content': 'https://facebook.com/FatherEdwardBeck'}, {'code_type': 'twitter', 'code_content': 'https://twitter.com/FrEdwardBeck'}, {'code_type': 'www.instagram', 'code_content': 'https://www.instagram.com/fredwardbeck'}]",https://us.cnn.com/profiles/father-edward-beck-profile,https://cdn.cnn.com/cnnnext/dam/assets/151029151239-father-edward-beck-large-169.jpg
cnn_roger-clark,Roger Clark,Roger Clark is Vice President and the Hong Kong Bureau Chief for CNN International.,[],https://us.cnn.com/profiles/roger-clark,https://cdn.cnn.com/cnnnext/dam/assets/200720155756-roger-clark-2020-large-169.jpg
cnn_angela-barajas-profile,Angela Barajas ,"Angela Barajas is a bilingual Field Producer based at the network's global headquarters in Atlanta, Georgia.",[],https://us.cnn.com/profiles/angela-barajas-profile,https://cdn.cnn.com/cnnnext/dam/assets/180611155941-angela-barajas-bio-image-large-169.jpg
cnn_kaitlan-collins,Kaitlan Collins,"Kaitlan Collins is CNN's Chief White House Correspondent based in Washington, D.C.","[{'code_type': 'twitter', 'code_content': 'https://twitter.com/kaitlancollins'}]",https://us.cnn.com/profiles/kaitlan-collins,https://cdn.cnn.com/cnnnext/dam/assets/220208105002-kaitlan-collins-headshot-large-169.jpg
cnn_barbara-arvanitidis,Barbara Arvanitidis,Barbara Arvanitidis is an award-winning senior producer based in London.  ,[],https://us.cnn.com/profiles/barbara-arvanitidis,https://cdn.cnn.com/cnnnext/dam/assets/150212224154-anchor-background-large-169.jpg
cnn_laura-bernardini,Laura Bernardini,Laura Bernardini is the Vice President of News for CNN/U.S. ,[],https://us.cnn.com/profiles/laura-bernardini,https://cdn.cnn.com/cnnnext/dam/assets/200323152951-laura-bernardini-profile-large-169.jpg
cnn_tatiana-arias-profile,Tatiana Arias ,Tatiana Arias is a News Desk Researcher on the International Desk at CNN's World Headquarters in Atlanta. ,[],https://us.cnn.com/profiles/tatiana-arias-profile,https://cdn.cnn.com/cnnnext/dam/assets/210804160443-tatiana-arias-profile-photo-large-169.jpg
