id,name,introduction,code_list,url,img_url
cnn_sara-murray,Sara Murray ,"Sara Murray is a CNN political correspondent based in Washington, D.C. ","[{'code_type': 'twitter', 'code_content': 'https://twitter.com/SaraMurray'}, {'code_type': 'www.instagram', 'code_content': 'https://www.instagram.com/saraemurray'}]",https://us.cnn.com/profiles/sara-murray,https://cdn.cnn.com/cnnnext/dam/assets/150422092921-sara-murray-profile-large-169.jpg
cnn_mark-morales,Mark Morales,"CNN law enforcement reporter. He focuses on the New York Police Department and other local, state and federal agencies in the northeast. He is New York based. ",[],https://us.cnn.com/profiles/mark-morales,https://cdn.cnn.com/cnnnext/dam/assets/200115164828-mark-morales-large-169.jpg
cnn_kara-scannell-profile,Kara Scannell,"Kara Scannell is a CNN correspondent based in New York covering law, crime and business investigations.",[],https://us.cnn.com/profiles/kara-scannell-profile,https://cdn.cnn.com/cnnnext/dam/assets/180501155607-kara-scannell-headshot-large-169.jpg
cnn_jeanne-moos-profile,Jeanne Moos,"Jeanne Moos is a national news correspondent based in New York. During her 34 years at CNN, Moos has covered national and international issues and ground-breaking news and features, but she soon carved out a niche with her off-beat, thoughtful reporting on the quirkier aspects of life.","[{'code_type': 'twitter', 'code_content': 'https://twitter.com/JeanneMoos'}]",https://us.cnn.com/profiles/jeanne-moos-profile,https://cdn.cnn.com/cnnnext/dam/assets/140926164730-jeanne-moos-profile-image-large-169.jpg
cnn_will-ripley,Will Ripley,"Will Ripley is an award-winning Senior International Correspondent for CNN, based in Taipei. ","[{'code_type': 'facebook', 'code_content': 'https://facebook.com/willripleynews'}, {'code_type': 'twitter', 'code_content': 'https://twitter.com/willripleyCNN'}, {'code_type': 'www.instagram', 'code_content': 'https://www.instagram.com/willripleycnn'}]",https://us.cnn.com/profiles/will-ripley,https://cdn.cnn.com/cnnnext/dam/assets/200222164603-will-ripley-profile-large-169.jpg
cnn_dan-merica-profile,Dan Merica,"Dan Merica is a CNN National Political Reporter based in Washington, D.C.","[{'code_type': 'facebook', 'code_content': 'https://facebook.com/Dan-Merica-659931107443856'}, {'code_type': 'twitter', 'code_content': 'https://twitter.com/merica'}, {'code_type': 'www.instagram', 'code_content': 'https://www.instagram.com/danmericaCNN'}]",https://us.cnn.com/profiles/dan-merica-profile,https://cdn.cnn.com/cnnnext/dam/assets/170328144809-dan-merica-large-169.jpg
cnn_rene-marsh-profile,Rene Marsh,"Rene Marsh is a national correspondent for CNN, based in the network's Washington bureau.","[{'code_type': 'facebook', 'code_content': 'https://facebook.com/MARSHNEWS'}, {'code_type': 'twitter', 'code_content': 'https://twitter.com/@Rene_MarshCNN'}]",https://us.cnn.com/profiles/rene-marsh-profile,https://cdn.cnn.com/cnnnext/dam/assets/140929112607-rene-marsh-profile-image-large-169.jpg
cnn_miguel-marquez-profile,Miguel Marquez,Miguel Marquez is a CNN senior national correspondent based in New York.,"[{'code_type': 'twitter', 'code_content': 'https://twitter.com/miguelmarquez'}, {'code_type': 'www.instagram', 'code_content': 'https://www.instagram.com/miggymoo'}]",https://us.cnn.com/profiles/miguel-marquez-profile,https://cdn.cnn.com/cnnnext/dam/assets/140929110116-miguel-marquez-profile-image-large-169.jpg
cnn_manu-raju,Manu Raju,"Manu Raju is CNN's Chief Congressional Correspondent, covering Capitol Hill and campaign politics.","[{'code_type': 'facebook', 'code_content': 'https://facebook.com/mkraju00'}, {'code_type': 'twitter', 'code_content': 'https://twitter.com/mkraju'}]",https://us.cnn.com/profiles/manu-raju,https://cdn.cnn.com/cnnnext/dam/assets/160314164813-manu-raju-profile-large-169.jpg
cnn_alex-marquardt,Alex Marquardt,Alex Marquardt is an award-winning Senior National Security Correspondent based in the network's Washington bureau.,[],https://us.cnn.com/profiles/alex-marquardt,https://cdn.cnn.com/cnnnext/dam/assets/220208113436-alex-marquardt-2022-headshot-large-169.jpg
cnn_suzanne-malveaux-profile,Suzanne  Malveaux,"Award-winning journalist Suzanne Malveaux serves as the network's national correspondent, covering politics, national news, international events and culture.","[{'code_type': 'facebook', 'code_content': 'https://facebook.com/SuzanneCNN'}, {'code_type': 'twitter', 'code_content': 'https://twitter.com/SuzanneMalveaux'}]",https://us.cnn.com/profiles/suzanne-malveaux-profile,https://cdn.cnn.com/cnnnext/dam/assets/140929115738-suzanne-malveaux-profile-image-large-169.jpg
cnn_oren-liebermann,Oren Liebermann,Oren Liebermann is a CNN Pentagon correspondent based in Washington DC. ,"[{'code_type': 'facebook', 'code_content': 'https://facebook.com/orenliebermannnews'}, {'code_type': 'twitter', 'code_content': 'https://twitter.com/orenCNN'}]",https://us.cnn.com/profiles/oren-liebermann,https://cdn.cnn.com/cnnnext/dam/assets/170824162227-oren-liebermann-large-169.jpg
cnn_bob-ortega,Bob Ortega,"Bob Ortega is a senior writer for CNN Investigates, covering border and immigration issues from Phoenix, Arizona.","[{'code_type': 'twitter', 'code_content': 'https://twitter.com/Bob_Ortega'}]",https://us.cnn.com/profiles/bob-ortega,https://cdn.cnn.com/cnnnext/dam/assets/191216082200-bob-ortega-profile-photo-large-169.jpg
cnn_mj-lee,MJ Lee,MJ Lee is a White House correspondent for CNN.,"[{'code_type': 'facebook', 'code_content': 'https://facebook.com/mjlee.journalist'}, {'code_type': 'twitter', 'code_content': 'https://twitter.com/mj_lee'}, {'code_type': 'www.instagram', 'code_content': 'https://www.instagram.com/mj_cnn'}]",https://us.cnn.com/profiles/mj-lee,https://cdn.cnn.com/cnnnext/dam/assets/191001114902-mj-lee-profile-large-169.jpg
cnn_paul-r-la-monica-profile,Paul R. La Monica,Paul R. La Monica is a digital correspondent for CNN Business. He writes daily about the markets and blue chip companies and also appears regularly on CNNI's business programs. He tweets throughout the day on Twitter and StockTwits @LaMonicaBuzz.,"[{'code_type': 'twitter', 'code_content': 'https://twitter.com/LaMonicaBuzz'}]",https://us.cnn.com/profiles/paul-r-la-monica-profile,https://cdn.cnn.com/cnnnext/dam/assets/140929112209-paul-lamonica-profile-image-large-169.jpg
cnn_kyung-lah-profile,Kyung Lah,Kyung Lah is a Senior National Correspondent for CNN based in Los Angeles.,"[{'code_type': 'twitter', 'code_content': 'https://twitter.com/KyungLahCNN'}, {'code_type': 'www.instagram', 'code_content': 'https://www.instagram.com/kyunglahcnn'}]",https://us.cnn.com/profiles/kyung-lah-profile,https://cdn.cnn.com/cnnnext/dam/assets/200717122836-kyung-lah-profile-v2-large-169.jpg
cnn_randi-kaye-profile,Randi Kaye,"Randi Kaye is an Emmy Award-winning correspondent and anchor for CNN, based in New York City.  She reports for Anderson Cooper 360° and CNN's award-winning documentary unit.","[{'code_type': 'facebook', 'code_content': 'https://facebook.com/RandiKayeCNN'}, {'code_type': 'twitter', 'code_content': 'https://twitter.com/randikayeCNN'}, {'code_type': 'www.instagram', 'code_content': 'https://www.instagram.com/randikayecnn'}]",https://us.cnn.com/profiles/randi-kaye-profile,https://cdn.cnn.com/cnnnext/dam/assets/141222141123-randi-kaye-profile-headshot-large-169.jpg
cnn_jomana-karadsheh,Jomana Karadsheh ,Jomana Karadsheh is an international correspondent based in the network's Istanbul Bureau. She has reported extensively from across the Middle East and North Africa. ,[],https://us.cnn.com/profiles/jomana-karadsheh,https://cdn.cnn.com/cnnnext/dam/assets/220120115904-jomana-karadsheh-profile-large-169.jpg
cnn_donie-osullivan,Donie O'Sullivan,Donie O'Sullivan is a CNN correspondent covering the intersection of politics and technology.,"[{'code_type': 'twitter', 'code_content': 'https://twitter.com/donie'}, {'code_type': 'www.instagram', 'code_content': 'https://www.instagram.com/doniecnn'}]",https://us.cnn.com/profiles/donie-osullivan,https://cdn.cnn.com/cnnnext/dam/assets/191029113418-donie-osullivan-large-169.jpg
cnn_mark-preston-profile,Mark Preston,"Mark Preston is CNN's Vice President of Political & Special Events Programming and senior political analyst. He hosts ""Full Stop with Mark Preston"" on SiriusXM  POTUS 124.","[{'code_type': 'facebook', 'code_content': 'https://facebook.com/markprestoncnn'}, {'code_type': 'twitter', 'code_content': 'https://twitter.com/PrestonCNN'}]",https://us.cnn.com/profiles/mark-preston-profile,https://cdn.cnn.com/cnnnext/dam/assets/170405174016-mark-preston-large-169.jpg
cnn_athena-jones-profile,Athena Jones,Athena Jones serves as a CNN national correspondent based in New York.  ,"[{'code_type': 'facebook', 'code_content': 'https://facebook.com/AthenaCNN'}, {'code_type': 'twitter', 'code_content': 'https://twitter.com/AthenaCNN'}]",https://us.cnn.com/profiles/athena-jones-profile,https://cdn.cnn.com/cnnnext/dam/assets/140926154048-athena-jones-profile-image-large-169.jpg
cnn_melanie-hicken,Melanie Hicken,Melanie Hicken is an award-winning investigative reporter for CNN. Her work has exposed everything from widespread sexual abuse in nursing homes to one of the longest-running scams in history. It has also inspired legislative action and government investigation. Email her at watchdog@cnn.com. ,"[{'code_type': 'twitter', 'code_content': 'https://twitter.com/melhicken'}]",https://us.cnn.com/profiles/melanie-hicken,https://cdn.cnn.com/cnnnext/dam/assets/180411094843-melanie-hicken-large-169.jpg
cnn_nia-malika-henderson,Nia-Malika Henderson,"Nia-Malika Henderson is a senior political analyst for CNN, reporting on politics, policies, and people shaping Washington.","[{'code_type': 'facebook', 'code_content': 'https://facebook.com/Nia-Malika-Henderson-1643963432532915'}, {'code_type': 'twitter', 'code_content': 'https://twitter.com/NiaCNN'}]",https://us.cnn.com/profiles/nia-malika-henderson,https://cdn.cnn.com/cnnnext/dam/assets/150422092917-nia-malika-henderson-profile-large-169.jpg
cnn_paula-hancocks,Paula Hancocks,"Paula Hancocks is an award-winning international correspondent for CNN based in Seoul, South Korea.","[{'code_type': 'facebook', 'code_content': 'https://facebook.com/PaulaHancocks'}, {'code_type': 'twitter', 'code_content': 'https://twitter.com/PHancocksCNN'}, {'code_type': 'www.instagram', 'code_content': 'https://www.instagram.com/phancockscnn'}]",https://us.cnn.com/profiles/paula-hancocks,https://cdn.cnn.com/cnnnext/dam/assets/150703102759-paul-hancocks-new-large-169.jpg
cnn_chloe-melas,Chloe Melas,"Chloe Melas is an entertainment reporter for CNN, covering all things entertainment and Hollywood for the network across platforms. ","[{'code_type': 'facebook', 'code_content': 'https://facebook.com/ChloeMelasMazza'}, {'code_type': 'twitter', 'code_content': 'https://twitter.com/Chloe_Melas'}, {'code_type': 'www.instagram', 'code_content': 'https://www.instagram.com/chloemelas'}]",https://us.cnn.com/profiles/chloe-melas,https://cdn.cnn.com/cnnnext/dam/assets/180913113039-chloe-melas-headshot-large-169.jpg
cnn_drew-griffin-profile,Drew Griffin,Drew Griffin is a correspondent for the investigative unit of CNN/U.S.,"[{'code_type': 'twitter', 'code_content': 'https://twitter.com/DrewGriffinCNN'}]",https://us.cnn.com/profiles/drew-griffin-profile,https://cdn.cnn.com/cnnnext/dam/assets/140926161840-drew-griffin-profile-image-large-169.jpg
cnn_chad-myers-profile,Chad Myers,Chad Myers is a meteorologist and the severe weather expert for CNN. Myers joined the network in 1999 and is based at the headquarters in Atlanta.  ,"[{'code_type': 'twitter', 'code_content': 'https://twitter.com/ChadMyersCNN'}]",https://us.cnn.com/profiles/chad-myers-profile,https://cdn.cnn.com/cnnnext/dam/assets/150303134155-chad-myers-profile-image-large-169.jpg
cnn_hadas-gold,Hadas Gold,Hadas Gold is CNN's Jerusalem Correspondent.,"[{'code_type': 'twitter', 'code_content': 'https://twitter.com/Hadas_Gold'}]",https://us.cnn.com/profiles/hadas-gold,https://cdn.cnn.com/cnnnext/dam/assets/171009111709-hadas-gold-large-169.jpg
cnn_david-mckenzie,David McKenzie,"David McKenzie is an award-winning international correspondent for CNN based in Johannesburg, South Africa. ","[{'code_type': 'facebook', 'code_content': 'https://facebook.com/mckenziecnn'}, {'code_type': 'twitter', 'code_content': 'https://twitter.com/@McKenzieCNN'}, {'code_type': 'www.instagram', 'code_content': 'https://www.instagram.com/mckenziecnn'}]",https://us.cnn.com/profiles/david-mckenzie,https://cdn.cnn.com/cnnnext/dam/assets/141218142114-david-mckenzie-profile-large-169.jpg
cnn_eleni-giokos,Eleni Giokos,Eleni Giokos is a CNN anchor and correspondent based in Dubai.,"[{'code_type': 'twitter', 'code_content': 'https://twitter.com/EleniGiokos'}]",https://us.cnn.com/profiles/eleni-giokos,https://cdn.cnn.com/cnnnext/dam/assets/200616170917-eleni-giokos-profile-photo-large-169.jpg
cnn_jamie-gangel-profile,Jamie Gangel,"Jamie Gangel, an award-winning veteran correspondent, joined CNN in August 2015. ","[{'code_type': 'twitter', 'code_content': 'https://twitter.com/jamiegangel'}]",https://us.cnn.com/profiles/jamie-gangel-profile,https://cdn.cnn.com/cnnnext/dam/assets/180813133317-jamie-gangel-profile-large-169.jpg
cnn_dianne-gallagher-profile,Dianne Gallagher,"Dianne Gallagher is a CNN National Correspondent based in Charlotte, North Carolina.","[{'code_type': 'twitter', 'code_content': 'https://twitter.com/https://twitter.com/dianneg'}]",https://us.cnn.com/profiles/dianne-gallagher-profile,https://cdn.cnn.com/cnnnext/dam/assets/170209140623-dianne-gallagher-profile-pic-large-169.jpg
cnn_phil-mattingliy-profile,Phil Mattingly ,"Phil Mattingly is CNN's senior White House correspondent, based in the Washington, D.C. bureau. ",[],https://us.cnn.com/profiles/phil-mattingliy-profile,https://cdn.cnn.com/cnnnext/dam/assets/160629141409-phil-mattingly-profile-large-169.jpg
cnn_tom-foreman-profile,Tom Foreman,"Tom Foreman is an Emmy award-winning journalist whose experience spans more than three decades, and virtually every major news story in that time period.","[{'code_type': 'facebook', 'code_content': 'https://facebook.com/tomforemancnn'}, {'code_type': 'twitter', 'code_content': 'https://twitter.com/tomforemancnn'}]",https://us.cnn.com/profiles/tom-foreman-profile,https://cdn.cnn.com/cnnnext/dam/assets/140929121259-tom-foreman-profile-image-large-169.jpg
cnn_rosa-flores-profile,Rosa Flores,"Rosa Flores is a CNN correspondent based in Houston, covering domestic and international news stories.","[{'code_type': 'facebook', 'code_content': 'https://facebook.com/rosaflorescnn'}, {'code_type': 'twitter', 'code_content': 'https://twitter.com/RosaFlores'}, {'code_type': 'www.instagram', 'code_content': 'https://www.instagram.com/rosaflorescnn'}]",https://us.cnn.com/profiles/rosa-flores-profile,https://cdn.cnn.com/cnnnext/dam/assets/160921180537-rosa-flores-profile-large-169.jpg
cnn_alexandra-field-profile,Alexandra Field,Alexandra Field is a correspondent covering major breaking news events for CNN and CNN International. She has reported from more than 20 countries.,"[{'code_type': 'twitter', 'code_content': 'https://twitter.com/AFieldCNN'}]",https://us.cnn.com/profiles/alexandra-field-profile,https://cdn.cnn.com/cnnnext/dam/assets/170824163407-alexandra-field-profile-v2-large-169.jpg
cnn_ashley-fantz-profile,Ashley Fantz,"Ashley Fantz has been a reporter for CNN since 2006. With CNN Investigates, she reports on crime, military issues and gender.","[{'code_type': 'twitter', 'code_content': 'https://twitter.com/afantz'}]",https://us.cnn.com/profiles/ashley-fantz-profile,https://cdn.cnn.com/cnnnext/dam/assets/181128103929-ashley-fantz-headshot-large-169.jpg
cnn_blake-essig,Blake Essig,Blake Essig is an award-winning international correspondent for CNN based at the network's Tokyo bureau.,[],https://us.cnn.com/profiles/blake-essig,https://cdn.cnn.com/cnnnext/dam/assets/200123115151-blake-essig-profile-2020-large-169.jpg
cnn_ed-lavandera-profile,Ed Lavandera,Ed Lavandera is a National Correspondent for CNN U.S. based in the Dallas bureau.,"[{'code_type': 'twitter', 'code_content': 'https://twitter.com/edlavaCNN'}, {'code_type': 'www.instagram', 'code_content': 'https://www.instagram.com/edlavacnn'}]",https://us.cnn.com/profiles/ed-lavandera-profile,https://cdn.cnn.com/cnnnext/dam/assets/140926161905-ed-lavandera-profile-image-large-169.jpg
cnn_blake-ellis,Blake Ellis,Blake Ellis is an award-winning investigative reporter for CNN. Her work has exposed everything from widespread sexual abuse in nursing homes to one of the longest-running scams in history. It has also inspired legislative action and government investigation. Email her at watchdog@cnn.com.,"[{'code_type': 'twitter', 'code_content': 'https://twitter.com/@blakeellis3'}]",https://us.cnn.com/profiles/blake-ellis,https://cdn.cnn.com/cnnnext/dam/assets/140926154233-blake-ellis-profile-image-large-169.jpg
cnn_jennifer-gray-profile,Jennifer Gray,Jennifer Gray is a meteorologist for CNN based in Atlanta at the network's global headquarters.,"[{'code_type': 'facebook', 'code_content': 'https://facebook.com/Jennifergraycnn'}, {'code_type': 'twitter', 'code_content': 'https://twitter.com/JenniferGrayCNN'}]",https://us.cnn.com/profiles/jennifer-gray-profile,https://cdn.cnn.com/cnnnext/dam/assets/150303140044-jennifer-gray-profile-image-large-169.jpg
cnn_stephanie-elam-profile,Stephanie Elam,Stephanie Elam is a CNN correspondent based in the network's Los Angeles bureau.,"[{'code_type': 'facebook', 'code_content': 'https://facebook.com/StephanieElam'}, {'code_type': 'twitter', 'code_content': 'https://twitter.com/StephanieElam'}, {'code_type': 'www.instagram', 'code_content': 'https://www.instagram.com/stephelamtv'}]",https://us.cnn.com/profiles/stephanie-elam-profile,https://cdn.cnn.com/cnnnext/dam/assets/200122131146-stephanie-elam-profile-2019-large-169.jpg
cnn_kristen-holmes-bio,Kristen Holmes,"Kristen Holmes is a correspondent for CNN, based in the Washington, D.C. bureau.","[{'code_type': 'facebook', 'code_content': 'https://facebook.com/kristenholmesreporter'}, {'code_type': 'twitter', 'code_content': 'https://twitter.com/@kristenhCNN'}]",https://us.cnn.com/profiles/kristen-holmes-bio,https://cdn.cnn.com/cnnnext/dam/assets/170126163731-kristen-holmes-profile-picture-large-169.jpg
cnn_jeremy-diamond,Jeremy Diamond,"Jeremy Diamond is a White House correspondent for CNN based in Washington, D.C., where he covers the Biden administration.","[{'code_type': 'facebook', 'code_content': 'https://facebook.com/jdiamond15'}, {'code_type': 'twitter', 'code_content': 'https://twitter.com/JDiamond1'}, {'code_type': 'www.instagram', 'code_content': 'https://www.instagram.com/jdiamond1_'}]",https://us.cnn.com/profiles/jeremy-diamond,https://cdn.cnn.com/cnnnext/dam/assets/220208105528-jeremy-diamond-headshot-large-169.jpg
cnn_joe-johns-profile,Joe Johns,"Joe Johns is CNN's senior Washington correspondent, responsible for covering a wide range of political and breaking news stories for the network. Prior to his current role, Johns served as a justice correspondent, covering the Supreme Court, legal and crime issues.","[{'code_type': 'twitter', 'code_content': 'https://twitter.com/joejohnscnn'}]",https://us.cnn.com/profiles/joe-johns-profile,https://cdn.cnn.com/cnnnext/dam/assets/150105143704-joe-johns-large-169.jpg
cnn_arwa-damon,Arwa Damon,Arwa Damon is an award-winning senior international correspondent based in CNN's Istanbul bureau.,"[{'code_type': 'twitter', 'code_content': 'https://twitter.com/arwaCNN'}, {'code_type': 'www.instagram', 'code_content': 'https://www.instagram.com/arwacnn'}]",https://us.cnn.com/profiles/arwa-damon,https://cdn.cnn.com/cnnnext/dam/assets/181120155019-arwa-damon-2018-large-169.jpg
cnn_rachel-crane-profile,Rachel Crane,Rachel Crane is an innovation and space correspondent for CNN. ,"[{'code_type': 'twitter', 'code_content': 'https://twitter.com/rachcrane'}, {'code_type': 'www.instagram', 'code_content': 'https://www.instagram.com/rachelmcrane'}]",https://us.cnn.com/profiles/rachel-crane-profile,https://cdn.cnn.com/cnnnext/dam/assets/140929112442-rachel-crane-profile-image-large-169.jpg
cnn_stephen-collinson,Stephen Collinson,"Stephen Collinson is a reporter for CNN Politics covering the White House, and politics across the United States and around the world.","[{'code_type': 'facebook', 'code_content': 'https://facebook.com/StephenCollinsonCNN'}, {'code_type': 'twitter', 'code_content': 'https://twitter.com/StCollinson'}, {'code_type': 'www.instagram', 'code_content': 'https://www.instagram.com/steve834'}]",https://us.cnn.com/profiles/stephen-collinson,https://cdn.cnn.com/cnnnext/dam/assets/150506104237-stephen-collinson-profile-large-169.jpg
cnn_elizabeth-cohen,Elizabeth Cohen,"Elizabeth Cohen is senior medical correspondent for CNN's Health, Medical and Wellness unit, reporting breaking medical news and health consumer reporting on CNN and CNN.com. ","[{'code_type': 'facebook', 'code_content': 'https://facebook.com/elizabeth.cohen.9028'}, {'code_type': 'twitter', 'code_content': 'https://twitter.com/elizcohencnn'}]",https://us.cnn.com/profiles/elizabeth-cohen,https://cdn.cnn.com/cnnnext/dam/assets/140926162007-elizabeth-cohen-profile-image-large-169.jpg
cnn_chris-cillizza,Chris Cillizza,"Chris Cillizza is a CNN Politics Reporter and Editor-at-Large, covering national politics including the White House, Congress and every district they represent. His reporting lives under the brand, ","[{'code_type': 'facebook', 'code_content': 'https://facebook.com/chris.cillizza'}, {'code_type': 'twitter', 'code_content': 'https://twitter.com/ChrisCillizza'}]",https://us.cnn.com/profiles/chris-cillizza,https://cdn.cnn.com/cnnnext/dam/assets/171011105543-chris-cillizza-large-169.jpg
cnn_allison-chinchar-profile,Allison Chinchar,Allison Chinchar is a meteorologist for CNN and HLN. ,"[{'code_type': 'twitter', 'code_content': 'https://twitter.com/@AllisonChinchar'}]",https://us.cnn.com/profiles/allison-chinchar-profile,https://cdn.cnn.com/cnnnext/dam/assets/220306142257-allison-chinchar-large-169.jpg
cnn_natasha-chen,Natasha Chen,Natasha Chen is a CNN correspondent based in the network's Los Angeles bureau. ,[],https://us.cnn.com/profiles/natasha-chen,https://cdn.cnn.com/cnnnext/dam/assets/200129110358-natasha-chen-headshot-large-169.jpg
cnn_matthew-chance,Matthew Chance,"Matthew Chance is CNN's senior international correspondent based in Moscow. He has reported extensively on major stories for CNN's global news networks from the Middle East, Afghanistan, Russia and Chechnya, Europe and the Far East for more than 20 years.","[{'code_type': 'twitter', 'code_content': 'https://twitter.com/mchancecnn'}]",https://us.cnn.com/profiles/matthew-chance,https://cdn.cnn.com/cnnnext/dam/assets/140929105802-matthew-chance-profile-image-large-169.jpg
cnn_clare-foran,Clare Foran,Clare Foran is a congressional Reporter for CNN Politics.,"[{'code_type': 'twitter', 'code_content': 'https://twitter.com/ckmarie'}]",https://us.cnn.com/profiles/clare-foran,https://cdn.cnn.com/cnnnext/dam/assets/180507170016-clare-foran-large-169.jpg
cnn_jean-casarez-profile,Jean Casarez,"Jean Casarez is a correspondent for CNN covering a wide variety of stories for the network including legal and crime, investigation and breaking news.","[{'code_type': 'twitter', 'code_content': 'https://twitter.com/JeanCasarezCNN'}]",https://us.cnn.com/profiles/jean-casarez-profile,https://cdn.cnn.com/cnnnext/dam/assets/141222154736-jean-casarez-profile-headshot-large-169.jpg
cnn_brynn-gingras-profile,Brynn Gingras,Brynn Gingras is a New York City based correspondent covering major breaking news events for the network. ,"[{'code_type': 'twitter', 'code_content': 'https://twitter.com/@BrynnCNN'}]",https://us.cnn.com/profiles/brynn-gingras-profile,https://cdn.cnn.com/cnnnext/dam/assets/160713141455-brynn-gingras-profile-large-169.jpg
cnn_david-culver,David Culver,"David Culver is an award-winning international correspondent for CNN, based at the network's Beijing bureau. ","[{'code_type': 'twitter', 'code_content': 'https://twitter.com/https://twitter.com/David_Culver'}]",https://us.cnn.com/profiles/david-culver,https://cdn.cnn.com/cnnnext/dam/assets/190807172520-david-culver-profile-large-169.jpg
cnn_josh-campbell,Josh Campbell,Josh Campbell is an award-winning CNN correspondent covering national security and law enforcement.,"[{'code_type': 'twitter', 'code_content': 'https://twitter.com/joshscampbell'}, {'code_type': 'www.instagram', 'code_content': 'https://www.instagram.com/joshcampbellcnn'}]",https://us.cnn.com/profiles/josh-campbell,https://cdn.cnn.com/cnnnext/dam/assets/190416173554-josh-campbell-expansion-photo-large-169.jpg
cnn_scott-glover,Scott Glover,Scott Glover is a reporter on the CNN Investigates team. He is based in Los Angeles.,"[{'code_type': 'twitter', 'code_content': 'https://twitter.com/ScottGloverCNN'}]",https://us.cnn.com/profiles/scott-glover,https://cdn.cnn.com/cnnnext/dam/assets/151103151158-scott-glover-large-169.jpg
cnn_nima-elbagir,Nima Elbagir,Nima Elbagir is CNN's multi-award winning Chief International Investigative Correspondent.,"[{'code_type': 'twitter', 'code_content': 'https://twitter.com/nimaelbagir'}]",https://us.cnn.com/profiles/nima-elbagir,https://cdn.cnn.com/cnnnext/dam/assets/181004143817-nima-elbagir-profile-photo-large-169.jpg
cnn_phil-black,Phil Black,Phil Black is an International Correspondent based in CNN's London bureau.,"[{'code_type': 'twitter', 'code_content': 'https://twitter.com/PhilBlackCNN'}, {'code_type': 'www.instagram', 'code_content': 'https://www.instagram.com/philblackcnn'}]",https://us.cnn.com/profiles/phil-black,https://cdn.cnn.com/cnnnext/dam/assets/140929112331-phil-black-profile-image1-large-169.jpg
